,Answer,Sent
270,Answer1,"If you ask environmentalists, they want the protection of the river, which may then lead to antagonism; policy makers want to bring the better life and they may not have many options available to them if they want to increase GDP."
271,Answer1,We need to balance between these for peace and development.
272,Answer1,Stakeholders may have access to different sets of information.
273,Answer1,The platforms that have been set up to bring them together often result in antagonism based on different information.
274,Answer1,"We need to find a peaceful way, and which institution should be responsible for this."
275,Answer1,How can the people be educated?
276,Answer1,They have to know what alternatives there are if they are to be told that they have to sacrifice something.
277,Answer1,The government needs to be committed to the people if we are to have trust.
278,Answer1,"If you promise jobs, and then you do not provide this, then they will not believe you next time."
279,Answer1,This is a serious problem.
280,Answer1,But the commitment is not just for the government to provide the people have to provide this as well.
281,Answer1,"Dr Poonpat provides an example of affected people accepting a compensation package and then, later, demanding more."
282,Answer1,"This too does not, he feels, result in trust."
283,Answer1,Trust is bi directional
284,Answer1, The biggest challenge is engagement.
285,Answer1,"The people along the Mekong have no rights to, for example, manage the resources of the river."
286,Answer1,The second big challenge is leveraging the knowledge we have to develop the Mekong.
287,Answer1,"Right now, the biggest motivation is economic development."
288,Answer1,But there has been so much research that shows that this does not work.
289,Answer1,Look at EIAs these are always conducted by just one party.
290,Answer1,"The current structure of the Mekong Rivers development includes the MRC, the LMC and the LMI, and is only conducted by the state no one else."
291,Answer1,This is not very effective because it is focussed only on economic development.
292,Answer1,The PNPCA process is not working effectively because it seems like a public hearing.
293,Answer1,The MRC has no authority to intervene or to cancel a dam that is not good.
294,Answer1,The PNPCA is just a rubber stamping exercise it cannot stop anything.
295,Answer1,The Thai government seems not to have an interest in the sustainable development of the Mekong even though it has eight provinces bordering the river.
296,Answer1,There is more interest in the Chao Phraya.
297,Answer1,"Government agencies are not, Mr Niwat says, up to date on things."
298,Answer1,"He wonders if they even know that there are 11 dams along the Mekong mainstream in China, and that there are two more on their way."
299,Answer1,They seem not to know.
300,Answer1,"Mr Niwat speaks of the current drought, which he attributes to these latter dams but the Thai government says that it is waiting for a report from the Chinese government."
301,Answer1,This is not good enough.
302,Answer1,"The Mekong is no longer a natural river, and this is not good at all."
303,Answer1,"We need now to discuss water releases, so that these can support the rivers ecology."
304,Answer1,"Also, the laws these are not issued fast enough to respond to the changing situation."
305,Answer1,"He references the Xayaburi dam, which, he says, saw a lot of money moving from Thailand to Laos."
306,Answer1,"Thai law does not address Thai investments in Laos, so developers and funders are not subject to the same standards as those operating inThailand."
307,Answer1,It is very important to list all of the challenges we are facing and to invite all the stakeholders to discuss them.
308,Answer1,He explains that his initiatives are looking to establish a council for the people living along the Mekong.
309,Answer1,"It will meet on December 1 2, 2020 in Chiang Rai, and will include civil society, and academics."
310,Answer1,He thinks that the Chinese and Thai states will be there because they are very interested in these things.
311,Answer1,Representatives from all of the eight Mekong provinces will attend.
312,Answer1,This is an effort to promote and advocate for the participation of people in the development of the Mekong.
313,Answer1,And also so we can know where the people stand with respect to this development.
314,Answer1,The power now is in the hands of the state and the private sector.
315,Answer1,"If the council is a success, it can be an example for other countries."
316,Answer1,Vietnam has expressed an interest.
317,Answer1,All of the MRC staff are from the state.
318,Answer1,Its policies are for the state.
319,Answer1,There is no public involvement.
320,Answer1," Mr Allen felt that there were three key issues: first, that development has been progressing very rapidly that has led to both positive and negative impacts on the river."
321,Answer1,"Industrial development has led to pollution, agricultural development has led to large amounts of water being syphoned off and agricultural runoff increased, housing development has led to increased demand for sand, etc."
322,Answer1,There hasnt been a systematic look at the potential impacts of development and where these will occur and no one talks about this.
323,Answer1,Other countries that have experienced rapid growth provide valuable lessons.
324,Answer1,"Second, demand for electricity is growing regionally."
325,Answer1,"It will be a big challenge to get the countries to talk with each other about power generation and supply, and for power systems to work together."
326,Answer1,Most decision makers dont know anything about power production.
327,Answer1,"By way of example, he pointed out that there is almost no storage hydropower in Laos  "
328,Answer1,most of it is run of river.
329,Answer1,This casts up questions of coordination and planning between countries.
330,Answer1,"Third, the issues of national sovereignty, and planning for individual countries rather than the region as a whole."
331,Answer1,"He referenced what he saw as the US problems around water supply, expensive litigation and conflict, and his concerns around water wars implying that something similar could happen in the Mekong."
332,Answer1," Mr Allen felt that there were three key issues: first, that development has been progressing very rapidly that has led to both positive and negative impacts on the river."
333,Answer1,"Industrial development has led to pollution, agricultural development has led to large amounts of water being syphoned off and agricultural runoff increased, housing development has led to increased demand for sand, etc."
334,Answer1,There hasnt been a systematic look at the potential impacts of development and where these will occur and no one talks about this.
335,Answer1,Other countries that have experienced rapid growth provide valuable lessons.
336,Answer1,"Second, demand for electricity is growing regionally."
337,Answer1,"It will be a big challenge to get the countries to talk with each other about power generation and supply, and for power systems to work together."
338,Answer1,Most decision makers dont know anything about power production.
339,Answer1,"By way of example, he pointed out that there is almost no storage hydropower in Laos  "
340,Answer1,most of it is run of river.
341,Answer1,This casts up questions of coordination and planning between countries.
342,Answer1,"Third, the issues of national sovereignty, and planning for individual countries rather than the region as a whole."
343,Answer1,"He referenced what he saw as the US problems around water supply, expensive litigation and conflict, and his concerns around water wars implying that something similar could happen in the Mekong."
344,Answer1," There are five challenges: first, the Mekong region, with its growing population, requires economic development, so as to ensure that we have water, food and energy security."
345,Answer1,We need all of the countries to implement joint projects to address this.
346,Answer1,"Second, the COVID pandemic: this has led to delays in all activities, tourism, etc."
347,Answer1,"Third, climate change is of extreme relevance."
348,Answer1,"There is increasing uncertainty with the rainfall regime, and there is often too much intense rainfall and flooding, including flash floods."
349,Answer1,"Fourth, competition between various regional mechanisms he lists a variety there is a lack of coordination amongst these, and the competition between them is a challenge to geo politics."
350,Answer1,"Fifth, there is a lack of investment to support the region; in particular, a lack of support to help Cambodia deal with climate change."
351,Answer1,"He references the delta where a wide variety of infrastructural interventions have helped them to adapt to climate change, including pumping stations, channels to release flood water, and others."
352,Answer1,Lack of coordination in financial/funding instruments for environmental protection and wetlands including implementation of research.
